{
  "schema_version": "orb-residential-named-source-signoff-v1",
  "artefact_kind": "template_only",
  "template_only": true,
  "not_valid_signoff": true,
  "not_sufficient_for_live_wiring": true,
  "not_evidence_of_named_review": true,
  "must_not_be_used_as_completed_signoff": true,
  "description": "TEMPLATE ONLY. This file is not valid named human sign-off, is not evidence of named review, and must not be used by runtime as completed sign-off. Copy to named_source_signoffs.json only after a named reviewer completes every required field with real attestations.",
  "signoffs": {
    "guide": {
      "source_id": "dfe_childrens_homes_regulations_guide",
      "source_title": "Guide to the Children's Homes Regulations including the Quality Standards",
      "source_type": "guide",
      "reviewer_name": "TBC — named reviewer required",
      "reviewer_role": "TBC",
      "reviewer_organisation": "TBC",
      "review_date": "TBC",
      "review_scope": "Offline verified Guide chunk artefact, Phase 2e policy, Phase 2f retrieval, Phase 2g/2h enforcement",
      "source_checksum_verified": false,
      "chunk_checksum_verified": false,
      "source_role_approved": false,
      "citation_policy_approved": false,
      "routing_policy_approved": false,
      "unsafe_output_blockers_approved": false,
      "boundary_statements_approved": false,
      "local_policy_limitation_acknowledged": false,
      "professional_judgement_boundary_acknowledged": false,
      "no_legal_advice_acknowledged": false,
      "no_compliance_guarantee_acknowledged": false,
      "synthetic_review_rejected_as_sufficient": false,
      "nr_1_controls_confirmed": false,
      "public_promise_remains_blocked": true,
      "signed_by_named_human": false,
      "signature_attestation": "TEMPLATE ONLY — not a valid signature attestation",
      "created_at": "TEMPLATE_ONLY",
      "provenance": {
        "artefact_kind": "template_only",
        "template_only": true,
        "not_valid_signoff": true,
        "not_sufficient_for_live_wiring": true,
        "not_evidence_of_named_review": true
      }
    },
    "regulations_2015": {
      "source_id": "childrens_homes_regulations_2015",
      "source_title": "The Children's Homes (England) Regulations 2015",
      "source_type": "regulations_2015",
      "reviewer_name": "TBC — named reviewer required",
      "reviewer_role": "TBC",
      "reviewer_organisation": "TBC",
      "review_date": "TBC",
      "review_scope": "Offline verified Regulations 2015 source and chunk artefacts, Phase 2e policy, Phase 2f retrieval, Phase 2g/2h enforcement",
      "source_checksum_verified": false,
      "chunk_checksum_verified": false,
      "source_role_approved": false,
      "citation_policy_approved": false,
      "routing_policy_approved": false,
      "unsafe_output_blockers_approved": false,
      "boundary_statements_approved": false,
      "local_policy_limitation_acknowledged": false,
      "professional_judgement_boundary_acknowledged": false,
      "no_legal_advice_acknowledged": false,
      "no_compliance_guarantee_acknowledged": false,
      "synthetic_review_rejected_as_sufficient": false,
      "nr_1_controls_confirmed": false,
      "public_promise_remains_blocked": true,
      "signed_by_named_human": false,
      "signature_attestation": "TEMPLATE ONLY — not a valid signature attestation",
      "created_at": "TEMPLATE_ONLY",
      "provenance": {
        "artefact_kind": "template_only",
        "template_only": true,
        "not_valid_signoff": true,
        "not_sufficient_for_live_wiring": true,
        "not_evidence_of_named_review": true
      }
    },
    "sccif": {
      "source_id": "ofsted_sccif_childrens_homes",
      "source_title": "Social care common inspection framework (SCCIF): children's homes",
      "source_type": "sccif",
      "reviewer_name": "TBC — named reviewer required",
      "reviewer_role": "TBC",
      "reviewer_organisation": "TBC",
      "review_date": "TBC",
      "review_scope": "Offline verified SCCIF children's homes source and chunk artefacts, Phase 2e policy, Phase 2f retrieval, Phase 2g/2h enforcement",
      "source_checksum_verified": false,
      "chunk_checksum_verified": false,
      "source_role_approved": false,
      "citation_policy_approved": false,
      "routing_policy_approved": false,
      "unsafe_output_blockers_approved": false,
      "boundary_statements_approved": false,
      "local_policy_limitation_acknowledged": false,
      "professional_judgement_boundary_acknowledged": false,
      "no_legal_advice_acknowledged": false,
      "no_compliance_guarantee_acknowledged": false,
      "no_ofsted_grade_prediction_acknowledged": false,
      "no_inspection_readiness_decision_acknowledged": false,
      "no_inspection_outcome_guarantee_acknowledged": false,
      "synthetic_review_rejected_as_sufficient": false,
      "nr_1_controls_confirmed": false,
      "public_promise_remains_blocked": true,
      "signed_by_named_human": false,
      "signature_attestation": "TEMPLATE ONLY — not a valid signature attestation",
      "created_at": "TEMPLATE_ONLY",
      "provenance": {
        "artefact_kind": "template_only",
        "template_only": true,
        "not_valid_signoff": true,
        "not_sufficient_for_live_wiring": true,
        "not_evidence_of_named_review": true
      }
    }
  }
}
